[
  {
    "source_entity_id": "src_suspilne_media",
    "display_name": "Суспільне Мовлення",
    "aliases": [
      "Суспільне Новини",
      "Суспільне Запоріжжя",
      "Суспільне Дніпро"
    ],
    "entity_type": "outlet",
    "languages": [
      "uk"
    ],
    "websites": [
      "https://suspilne.media/"
    ],
    "topics": [
      "ukraine_war",
      "ukrainian_media",
      "operations",
      "civil_defence",
      "mobilization"
    ],
    "assessments": [],
    "record_status": "draft",
    "updated_at": "2026-08-05T04:46:14Z"
  }
]
