[
  {
    "source_entity_id": "src_general_staff_ua",
    "display_name": "Генеральний штаб Збройних Сил України",
    "aliases": [
      "Генеральний штаб ЗСУ"
    ],
    "entity_type": "official_body",
    "languages": [
      "uk"
    ],
    "handles": {
      "telegram": "@GeneralStaffZSU"
    },
    "websites": [
      "https://t.me/GeneralStaffZSU"
    ],
    "topics": [
      "ukraine_war",
      "frontline_reporting",
      "strikes",
      "air_defense"
    ],
    "assessments": [],
    "record_status": "draft",
    "updated_at": "2026-08-05T04:42:38Z"
  },
  {
    "source_entity_id": "src_president_ua",
    "display_name": "Президент України — Володимир Зеленський",
    "aliases": [
      "Zelenskiy / Official"
    ],
    "entity_type": "person",
    "languages": [
      "uk"
    ],
    "handles": {
      "telegram": "@v_zelenskiy_official"
    },
    "websites": [
      "https://t.me/v_zelenskiy_official"
    ],
    "topics": [
      "ukraine_war",
      "defense_policy",
      "air_defense"
    ],
    "assessments": [],
    "record_status": "draft",
    "updated_at": "2026-08-05T04:42:38Z"
  },
  {
    "source_entity_id": "src_air_force_ua",
    "display_name": "Повітряні Сили Збройних Сил України",
    "aliases": [
      "Air Force of the Armed Forces of Ukraine"
    ],
    "entity_type": "official_body",
    "languages": [
      "uk"
    ],
    "handles": {
      "telegram": "@kpszsu"
    },
    "websites": [
      "https://t.me/kpszsu"
    ],
    "topics": [
      "ukraine_war",
      "air_defense",
      "air_operations"
    ],
    "assessments": [],
    "record_status": "draft",
    "updated_at": "2026-08-05T04:42:38Z"
  },
  {
    "source_entity_id": "src_dsns_ua",
    "display_name": "Державна служба України з надзвичайних ситуацій",
    "aliases": [
      "ДСНС України"
    ],
    "entity_type": "official_body",
    "languages": [
      "uk"
    ],
    "handles": {
      "telegram": "@dsns_telegram"
    },
    "websites": [
      "https://t.me/dsns_telegram"
    ],
    "topics": [
      "ukraine_war",
      "strike_aftermath",
      "civil_protection"
    ],
    "assessments": [],
    "record_status": "draft",
    "updated_at": "2026-08-05T04:42:38Z"
  }
]
