[
  {
    "source_entity_id": "src_vitaliy_klitschko",
    "display_name": "Vitali Klitschko official Telegram channel",
    "aliases": [
      "Віталій Кличко"
    ],
    "entity_type": "account",
    "languages": [
      "uk"
    ],
    "handles": {
      "telegram": "vitaliy_klitschko"
    },
    "websites": [
      "https://t.me/vitaliy_klitschko"
    ],
    "topics": [
      "ukraine_war",
      "civil_defense",
      "kyiv_governance"
    ],
    "assessments": [],
    "record_status": "draft",
    "updated_at": "2026-08-05T10:38:16Z"
  }
]
