[
  {
    "source_entity_id": "src_rvvoenkor",
    "display_name": "Операция Z: Военкоры Русской Весны",
    "aliases": [
      "Военкоры Русской Весны",
      "Russian Spring War Correspondents"
    ],
    "entity_type": "channel",
    "languages": [
      "ru"
    ],
    "handles": {
      "telegram": "@RVvoenkor"
    },
    "websites": [
      "https://t.me/RVvoenkor"
    ],
    "topics": [
      "ukraine_war",
      "military_commentary",
      "russian_milbloggers"
    ],
    "assessments": [],
    "record_status": "draft",
    "updated_at": "2026-08-05T05:14:00Z"
  },
  {
    "source_entity_id": "src_colonelcassad",
    "display_name": "Colonelcassad",
    "aliases": [
      "Борис Рожин"
    ],
    "entity_type": "channel",
    "languages": [
      "ru"
    ],
    "handles": {
      "telegram": "@boris_rozhin"
    },
    "websites": [
      "https://t.me/boris_rozhin"
    ],
    "topics": [
      "ukraine_war",
      "military_commentary",
      "russian_milbloggers"
    ],
    "assessments": [],
    "record_status": "draft",
    "updated_at": "2026-08-05T05:14:00Z"
  }
]
