[
  {
    "source_entity_id": "src_the_guardian",
    "display_name": "The Guardian",
    "entity_type": "outlet",
    "languages": [
      "en"
    ],
    "websites": [
      "https://www.theguardian.com/"
    ],
    "topics": [
      "international_media",
      "ukraine_war",
      "operations",
      "external_support"
    ],
    "record_status": "draft",
    "assessments": [],
    "updated_at": "2026-08-05T04:45:09Z"
  }
]
