[
  {
    "source_entity_id": "src_associated_press",
    "display_name": "The Associated Press",
    "aliases": [
      "AP",
      "AP News"
    ],
    "entity_type": "outlet",
    "languages": [
      "en"
    ],
    "websites": [
      "https://apnews.com"
    ],
    "topics": [
      "civilian_harm",
      "conflict_reporting",
      "infrastructure",
      "reactions",
      "shipping",
      "ukraine_war"
    ],
    "record_status": "draft",
    "assessments": [],
    "updated_at": "2026-08-05T04:59:00Z"
  },
  {
    "source_entity_id": "src_financial_times",
    "display_name": "Financial Times",
    "aliases": [
      "FT"
    ],
    "entity_type": "outlet",
    "languages": [
      "en"
    ],
    "websites": [
      "https://www.ft.com"
    ],
    "topics": [
      "conflict_reporting",
      "infrastructure",
      "logistics"
    ],
    "record_status": "draft",
    "assessments": [],
    "updated_at": "2026-08-05T04:45:38Z"
  }
]
