[
  {
    "source_entity_id": "src_institute_for_study_of_war",
    "display_name": "Institute for the Study of War",
    "aliases": [
      "ISW"
    ],
    "entity_type": "organization",
    "languages": [
      "en"
    ],
    "websites": [
      "https://understandingwar.org/"
    ],
    "topics": [
      "ukraine_war",
      "military_analysis",
      "capabilities",
      "logistics"
    ],
    "assessments": [],
    "record_status": "draft",
    "updated_at": "2026-08-05T04:45:51Z"
  },
  {
    "source_entity_id": "src_royal_united_services_institute",
    "display_name": "Royal United Services Institute",
    "aliases": [
      "RUSI"
    ],
    "entity_type": "organization",
    "languages": [
      "en"
    ],
    "websites": [
      "https://www.rusi.org/"
    ],
    "topics": [
      "ukraine_war",
      "military_analysis",
      "capabilities",
      "logistics"
    ],
    "assessments": [],
    "record_status": "draft",
    "updated_at": "2026-08-05T04:45:51Z"
  },
  {
    "source_entity_id": "src_war_on_the_rocks",
    "display_name": "War on the Rocks",
    "entity_type": "outlet",
    "languages": [
      "en"
    ],
    "websites": [
      "https://warontherocks.com/"
    ],
    "topics": [
      "ukraine_war",
      "military_analysis",
      "capabilities",
      "logistics"
    ],
    "assessments": [],
    "record_status": "draft",
    "updated_at": "2026-08-05T04:45:51Z"
  },
  {
    "source_entity_id": "src_drone_warfare_dwim",
    "display_name": "Drone Warfare / DWIM",
    "entity_type": "project",
    "languages": [
      "en"
    ],
    "websites": [
      "https://drone-warfare.com/"
    ],
    "topics": [
      "ukraine_war",
      "military_analysis",
      "capabilities",
      "logistics",
      "unmanned_systems"
    ],
    "assessments": [],
    "record_status": "draft",
    "updated_at": "2026-08-05T04:45:51Z"
  }
]
