[
  {
    "source_entity_id": "src_dva_majors",
    "display_name": "Два майора",
    "aliases": [
      "Two Majors"
    ],
    "entity_type": "channel",
    "languages": [
      "ru"
    ],
    "handles": {
      "telegram": "@dva_majors"
    },
    "websites": [
      "https://t.me/dva_majors"
    ],
    "topics": [
      "ukraine_war",
      "military_commentary",
      "russian_milbloggers"
    ],
    "assessments": [],
    "record_status": "draft",
    "updated_at": "2026-08-05T04:46:26Z"
  },
  {
    "source_entity_id": "src_rybar",
    "display_name": "Рыбарь",
    "aliases": [
      "Rybar"
    ],
    "entity_type": "channel",
    "languages": [
      "ru"
    ],
    "handles": {
      "telegram": "@rybar"
    },
    "websites": [
      "https://t.me/rybar",
      "https://rybar.ru"
    ],
    "topics": [
      "ukraine_war",
      "military_analysis",
      "russian_milbloggers"
    ],
    "assessments": [],
    "record_status": "draft",
    "updated_at": "2026-08-05T04:46:26Z"
  }
]
