[
  {
    "source_entity_id": "src_reuters",
    "display_name": "Reuters",
    "aliases": [
      "Reuters News"
    ],
    "entity_type": "outlet",
    "languages": [
      "en"
    ],
    "websites": [
      "https://www.reuters.com"
    ],
    "topics": [
      "conflict_reporting",
      "corrections",
      "diplomacy",
      "infrastructure",
      "logistics",
      "military_support",
      "reactions",
      "sanctions",
      "shipping",
      "ukraine_war"
    ],
    "assessments": [],
    "record_status": "draft",
    "updated_at": "2026-08-05T04:59:00Z"
  }
]
