[
  {
    "source_entity_id": "src_reuters",
    "display_name": "Reuters",
    "aliases": [
      "Reuters News"
    ],
    "entity_type": "outlet",
    "languages": [
      "en"
    ],
    "websites": [
      "https://www.reuters.com/"
    ],
    "topics": [
      "ukraine_war",
      "reactions",
      "corrections"
    ],
    "assessments": [],
    "record_status": "draft",
    "updated_at": "2026-08-05T04:45:57Z"
  },
  {
    "source_entity_id": "src_associated_press",
    "display_name": "The Associated Press",
    "aliases": [
      "AP",
      "AP News"
    ],
    "entity_type": "outlet",
    "languages": [
      "en"
    ],
    "websites": [
      "https://apnews.com/"
    ],
    "topics": [
      "ukraine_war",
      "reactions"
    ],
    "assessments": [],
    "record_status": "draft",
    "updated_at": "2026-08-05T04:45:57Z"
  },
  {
    "source_entity_id": "src_guardian",
    "display_name": "The Guardian",
    "aliases": [
      "Guardian News & Media"
    ],
    "entity_type": "outlet",
    "languages": [
      "en"
    ],
    "websites": [
      "https://www.theguardian.com/"
    ],
    "topics": [
      "ukraine_war",
      "reactions",
      "criticism"
    ],
    "assessments": [],
    "record_status": "draft",
    "updated_at": "2026-08-05T04:45:57Z"
  }
]
