[
  {
    "source_entity_id": "src_deepstateua",
    "display_name": "DeepState",
    "aliases": ["DeepStateMap"],
    "entity_type": "project",
    "languages": ["uk", "en"],
    "handles": {
      "telegram": "DeepStateUA"
    },
    "websites": ["https://deepstatemap.live/en/"],
    "topics": ["visual_osint", "geolocation", "conflict_mapping", "ukraine_war"],
    "assessments": [],
    "record_status": "draft",
    "updated_at": "2026-08-05T04:44:56Z"
  },
  {
    "source_entity_id": "src_geoconfirmed",
    "display_name": "GeoConfirmed",
    "entity_type": "project",
    "languages": ["en"],
    "websites": ["https://geoconfirmed.org/", "https://geoconfirmed.org/ukraine"],
    "topics": ["visual_osint", "geolocation", "conflict_mapping", "ukraine_war"],
    "assessments": [],
    "record_status": "draft",
    "updated_at": "2026-08-05T04:44:56Z"
  },
  {
    "source_entity_id": "src_war_mapper",
    "display_name": "War Mapper",
    "entity_type": "project",
    "languages": ["en"],
    "websites": ["https://www.warmapper.org/", "https://warmapper.substack.com/"],
    "topics": ["visual_osint", "conflict_mapping", "ukraine_war"],
    "assessments": [],
    "record_status": "draft",
    "updated_at": "2026-08-05T04:44:56Z"
  }
]
