[
  {
    "source_entity_id": "src_ukrainska_pravda",
    "display_name": "Українська правда",
    "aliases": [
      "УП"
    ],
    "entity_type": "outlet",
    "languages": [
      "uk"
    ],
    "websites": [
      "https://www.pravda.com.ua/"
    ],
    "topics": [
      "ukraine_war",
      "ukrainian_media",
      "operations",
      "politics"
    ],
    "assessments": [],
    "record_status": "draft",
    "updated_at": "2026-08-05T05:14:18Z"
  }
]
