[
  {
    "source_entity_id": "src_ru_mod_official",
    "display_name": "Ministry of Defence of the Russian Federation",
    "aliases": [
      "Минобороны России"
    ],
    "entity_type": "official_body",
    "languages": [
      "ru"
    ],
    "handles": {
      "telegram": "@mod_russia"
    },
    "websites": [
      "https://mil.ru/",
      "https://t.me/s/mod_russia"
    ],
    "topics": [
      "russian_official_statements",
      "frontline",
      "strikes"
    ],
    "assessments": [],
    "record_status": "draft",
    "updated_at": "2026-08-05T04:42:39Z"
  },
  {
    "source_entity_id": "src_ru_mfa_official",
    "display_name": "Ministry of Foreign Affairs of the Russian Federation",
    "aliases": [
      "МИД России"
    ],
    "entity_type": "official_body",
    "languages": [
      "ru"
    ],
    "handles": {
      "telegram": "@MID_Russia"
    },
    "websites": [
      "https://www.mid.ru/",
      "https://t.me/s/MID_Russia"
    ],
    "topics": [
      "russian_official_statements"
    ],
    "assessments": [],
    "record_status": "draft",
    "updated_at": "2026-08-05T04:42:39Z"
  },
  {
    "source_entity_id": "src_ru_kremlin_news",
    "display_name": "Kremlin News",
    "aliases": [
      "Кремль. Новости"
    ],
    "entity_type": "official_body",
    "languages": [
      "ru"
    ],
    "handles": {
      "telegram": "@news_kremlin"
    },
    "websites": [
      "https://www.kremlin.ru/",
      "https://t.me/s/news_kremlin"
    ],
    "topics": [
      "russian_official_statements"
    ],
    "assessments": [],
    "record_status": "draft",
    "updated_at": "2026-08-05T04:42:39Z"
  }
]
